{
  "schema_version": "0.1.0",
  "titulo": "Ciclo XXX — Kit do Mestre: investigar sem decretar",
  "estado": "ferramenta_mesa_nao_canonica",
  "ambito": "eixo_do_rio_ancestral_e_interfaces",
  "fonte_manuscrito": "fontes/autoria/hack-carcaca-dw-capitulo-i.paginas.json",
  "aprovacao_autoral": false,
  "mutacao_canonica": false,
  "modificacao_regras_dw": false,
  "revolta_drakport_ocorreu": false,
  "rito_lunar_definido": false,
  "eventos_ocorridos": [],
  "resultados_sessoes": [],
  "fatos_base": [
    {
      "id": "mesa-xxx:fato:01",
      "pagina": 4,
      "afirmacao": "O Rio Ancestral estrutura circulação, comércio e conquista, com tributos e postos militares.",
      "limite_de_inferencia": "Não se conhecem as taxas, horários ou postos individualizados.",
      "fonte": "fontes/autoria/hack-carcaca-dw-capitulo-i.paginas.json",
      "aplicou_novo_canon": false
    },
    {
      "id": "mesa-xxx:fato:02",
      "pagina": 4,
      "afirmacao": "Drakport é centro de escravidão sob Lady Morwen Nightshade.",
      "limite_de_inferencia": "Não inferir caso individual nem resultado de um conflito de campanha.",
      "fonte": "fontes/autoria/hack-carcaca-dw-capitulo-i.paginas.json",
      "aplicou_novo_canon": false
    },
    {
      "id": "mesa-xxx:fato:03",
      "pagina": 4,
      "afirmacao": "O Templo da Lua fica numa ilha, onde Severina Shadowbloom conduz ritos associados ao controle da água.",
      "limite_de_inferencia": "Não inferir mecanismo, divindade, magnitude ou rota de acesso.",
      "fonte": "fontes/autoria/hack-carcaca-dw-capitulo-i.paginas.json",
      "aplicou_novo_canon": false
    },
    {
      "id": "mesa-xxx:fato:04",
      "pagina": 7,
      "afirmacao": "A resistência contra a Corte é descentralizada, com fugitivos de Drakport entre suas correntes.",
      "limite_de_inferencia": "Não presumir comando único, objetivos uniformes nem revolta já realizada.",
      "fonte": "fontes/autoria/hack-carcaca-dw-capitulo-i.paginas.json",
      "aplicou_novo_canon": false
    },
    {
      "id": "mesa-xxx:fato:05",
      "pagina": 11,
      "afirmacao": "A Revolta de Drakport e eventual papel de Ironwood são perguntas históricas sem resposta.",
      "limite_de_inferencia": "Não antecipar data, vitória, fracasso ou participação obrigatória de rangers.",
      "fonte": "fontes/autoria/hack-carcaca-dw-capitulo-i.paginas.json",
      "aplicou_novo_canon": false
    },
    {
      "id": "mesa-xxx:fato:06",
      "pagina": 22,
      "afirmacao": "Na Carcaça coexistem panteões e tradições, e a existência dos deuses não implica autoridade moral única.",
      "limite_de_inferencia": "Não atribuir automaticamente uma divindade ao Templo da Lua.",
      "fonte": "fontes/autoria/hack-carcaca-dw-capitulo-i.paginas.json",
      "aplicou_novo_canon": false
    }
  ],
  "referencias_rastreaveis": [
    {
      "arquivo": "data/worldbuilding/templo-lua-severina-ciclo29.json",
      "colecao": "modelos_do_rito",
      "id": "worldbuilding-xxix:modelos_do_rito:ciclico",
      "uso": "Ancora proposta anterior: direciona consulta editorial, nunca prova o novo instrumento ou evento."
    },
    {
      "arquivo": "data/worldbuilding/templo-lua-severina-ciclo29.json",
      "colecao": "provas_e_incerteza",
      "id": "worldbuilding-xxix:provas_e_incerteza:observacao",
      "uso": "Ancora proposta anterior: direciona consulta editorial, nunca prova o novo instrumento ou evento."
    },
    {
      "arquivo": "data/worldbuilding/templo-lua-severina-ciclo29.json",
      "colecao": "provas_e_incerteza",
      "id": "worldbuilding-xxix:provas_e_incerteza:correlacao",
      "uso": "Ancora proposta anterior: direciona consulta editorial, nunca prova o novo instrumento ou evento."
    },
    {
      "arquivo": "data/worldbuilding/templo-lua-severina-ciclo29.json",
      "colecao": "provas_e_incerteza",
      "id": "worldbuilding-xxix:provas_e_incerteza:depoimento",
      "uso": "Ancora proposta anterior: direciona consulta editorial, nunca prova o novo instrumento ou evento."
    },
    {
      "arquivo": "data/worldbuilding/templo-lua-severina-ciclo29.json",
      "colecao": "provas_e_incerteza",
      "id": "worldbuilding-xxix:provas_e_incerteza:coercao",
      "uso": "Ancora proposta anterior: direciona consulta editorial, nunca prova o novo instrumento ou evento."
    },
    {
      "arquivo": "data/worldbuilding/templo-lua-severina-ciclo29.json",
      "colecao": "provas_e_incerteza",
      "id": "worldbuilding-xxix:provas_e_incerteza:medicao",
      "uso": "Ancora proposta anterior: direciona consulta editorial, nunca prova o novo instrumento ou evento."
    },
    {
      "arquivo": "data/worldbuilding/templo-lua-severina-ciclo29.json",
      "colecao": "tensoes_de_poder",
      "id": "worldbuilding-xxix:tensoes_de_poder:severina-morwen",
      "uso": "Ancora proposta anterior: direciona consulta editorial, nunca prova o novo instrumento ou evento."
    },
    {
      "arquivo": "data/worldbuilding/templo-lua-severina-ciclo29.json",
      "colecao": "tensoes_de_poder",
      "id": "worldbuilding-xxix:tensoes_de_poder:lua-divindade",
      "uso": "Ancora proposta anterior: direciona consulta editorial, nunca prova o novo instrumento ou evento."
    },
    {
      "arquivo": "data/worldbuilding/templo-lua-severina-ciclo29.json",
      "colecao": "interfaces_civis",
      "id": "worldbuilding-xxix:interfaces_civis:recusa",
      "uso": "Ancora proposta anterior: direciona consulta editorial, nunca prova o novo instrumento ou evento."
    },
    {
      "arquivo": "data/worldbuilding/rio-drakport-ciclo28.json",
      "colecao": "tributos_e_passagens",
      "id": "worldbuilding-xxviii:tributos_e_passagens:cobranca",
      "uso": "Ancora proposta anterior: direciona consulta editorial, nunca prova o novo instrumento ou evento."
    },
    {
      "arquivo": "data/worldbuilding/rio-drakport-ciclo28.json",
      "colecao": "tributos_e_passagens",
      "id": "worldbuilding-xxviii:tributos_e_passagens:identidade",
      "uso": "Ancora proposta anterior: direciona consulta editorial, nunca prova o novo instrumento ou evento."
    },
    {
      "arquivo": "data/worldbuilding/rio-drakport-ciclo28.json",
      "colecao": "servidao_e_agencia",
      "id": "worldbuilding-xxviii:servidao_e_agencia:evasao",
      "uso": "Ancora proposta anterior: direciona consulta editorial, nunca prova o novo instrumento ou evento."
    },
    {
      "arquivo": "data/worldbuilding/rio-drakport-ciclo28.json",
      "colecao": "redes_de_resistencia",
      "id": "worldbuilding-xxviii:redes_de_resistencia:ironwood",
      "uso": "Ancora proposta anterior: direciona consulta editorial, nunca prova o novo instrumento ou evento."
    },
    {
      "arquivo": "data/worldbuilding/rio-drakport-ciclo28.json",
      "colecao": "informacao_e_ritos",
      "id": "worldbuilding-xxviii:informacao_e_ritos:boato",
      "uso": "Ancora proposta anterior: direciona consulta editorial, nunca prova o novo instrumento ou evento."
    },
    {
      "arquivo": "data/worldbuilding/foz-shadar-memoria-ciclo27.json",
      "colecao": "pactos_de_frente",
      "id": "worldbuilding-xxvii:pactos_de_frente:nao-e-paz",
      "uso": "Ancora proposta anterior: direciona consulta editorial, nunca prova o novo instrumento ou evento."
    },
    {
      "arquivo": "data/worldbuilding/foz-shadar-memoria-ciclo27.json",
      "colecao": "rio_e_trabalho",
      "id": "worldbuilding-xxvii:rio_e_trabalho:barreiras",
      "uso": "Ancora proposta anterior: direciona consulta editorial, nunca prova o novo instrumento ou evento."
    }
  ],
  "procedimentos": [
    {
      "id": "mesa-xxx:procedimento:origem",
      "nome": "Separar fonte de conjectura",
      "quando_usar": "Na primeira alegação extraordinária",
      "passos_de_mesa": "Escreva o que o manuscrito confirma, o que o personagem diz ter visto e o que a mesa ainda desconhece.",
      "evitar": "Não converter a conclusão do narrador em verdade física.",
      "referencia_id": "worldbuilding-xxix:provas_e_incerteza:observacao",
      "estado": "procedimento_editorial_nao_canonico",
      "executou": false
    },
    {
      "id": "mesa-xxx:procedimento:testemunhos",
      "nome": "Ouvir sem impor consenso",
      "quando_usar": "Quando relatos discordarem",
      "passos_de_mesa": "Peça circunstância, interesse, posição de observação e segunda fonte possível; mantenha versões separadas.",
      "evitar": "Não tratar testemunha oprimida como necessariamente menos confiável.",
      "referencia_id": "worldbuilding-xxix:provas_e_incerteza:depoimento",
      "estado": "procedimento_editorial_nao_canonico",
      "executou": false
    },
    {
      "id": "mesa-xxx:procedimento:causalidade",
      "nome": "Depois não é por causa",
      "quando_usar": "Quando ligarem um fenômeno ao rito",
      "passos_de_mesa": "Liste pelo menos duas causas concorrentes; peça ação observável que possa distingui-las.",
      "evitar": "Não concluir calendário, alcance ou vazão a partir de uma cena.",
      "referencia_id": "worldbuilding-xxix:provas_e_incerteza:correlacao",
      "estado": "procedimento_editorial_nao_canonico",
      "executou": false
    },
    {
      "id": "mesa-xxx:procedimento:consentimento",
      "nome": "Distinguir escolha e coerção",
      "quando_usar": "Quando um juramento, cobrança ou contrato surgir",
      "passos_de_mesa": "Identifique ameaça, possibilidade de recusa, testemunha e pessoa afetada; nunca assuma consentimento por obediência.",
      "evitar": "Não tornar violência colonial em simples transação econômica.",
      "referencia_id": "worldbuilding-xxix:provas_e_incerteza:coercao",
      "estado": "procedimento_editorial_nao_canonico",
      "executou": false
    },
    {
      "id": "mesa-xxx:procedimento:consequencias",
      "nome": "Consequências pertencem à mesa",
      "quando_usar": "Depois de uma escolha efetiva dos personagens",